<?xml version="1.0" encoding="UTF-8"?>
<Students xmlns:xsi="http://www.w3.org/2001/XMLSchema-instance"
      xsi:noNamespaceSchemaLocation="StudentsSchema.xsd">

<Student>
    <Name>Praneet</Name>
    <Age>21</Age>
    <College>Christ University</College>
</Student>
<Student>
    <Name>Yash</Name>
    <Age>21</Age>
    <College>St. Joseph University</College>
</Student>
<Student>
    <Name>Kishan</Name>
    <Age>21</Age>
    <College>Christ University</College>
</Student>
